{
  "id": "HOS-FOOT-WC-1982-POLAND-001",
  "title": "Polska na Mistrzostwach Świata 1982",
  "corpus": "PIŁKA NOŻNA",
  "category": "TURNIEJE/MISTRZOSTWA ŚWIATA/1982",
  "tags": ["Mundial 1982", "Hiszpania", "Polska", "trzecie miejsce", "Zbigniew Boniek"],
  "status": "review",
  "summary": "Kampania reprezentacji Polski na Mistrzostwach Świata FIFA 1982 w Hiszpanii, zakończona trzecim miejscem. Centralny węzeł dla drużyny, zawodników, spotkań i wydarzeń turnieju.",
  "relations": ["HOS-FOOT-POLAND-NT-001", "HOS-FOOT-ZBIGNIEW-BONIEK-001"],
  "sources": ["https://www.fifa.com/tournaments/mens/worldcup/1982spain"],
  "created_at": "2026-08-31T00:00:00+00:00"
}