{
  "id": "HOS-F1-DEREK-WARWICK-001",
  "title": "Derek Warwick",
  "corpus": "MOTORSPORT",
  "category": "FORMUŁA 1/KIEROWCY/ENDURANCE",
  "tags": [
    "Derek Warwick",
    "Renault",
    "Arrows",
    "Jaguar",
    "Le Mans"
  ],
  "status": "review",
  "summary": "Brytyjski kierowca F1 i endurance, wieloletni zawodnik Renault, Arrows i innych zespołów; zwycięzca 24 Hours of Le Mans 1992.",
  "sources": [],
  "created_at": "2026-08-30T18:58:37+00:00"
}
