{
  "id": "HOS-FOOT-POLAND-NT-001",
  "title": "Reprezentacja Polski w piłce nożnej",
  "corpus": "PIŁKA NOŻNA",
  "category": "REPREZENTACJE/POLSKA",
  "tags": ["Polska", "reprezentacja", "Mundial", "PZPN"],
  "status": "review",
  "summary": "Męska reprezentacja Polski w piłce nożnej. Węzeł nadrzędny dla turniejów, selekcjonerów, reprezentantów i najważniejszych meczów w historii polskiej kadry.",
  "relations": ["HOS-FOOT-PZPN-001", "HOS-FOOT-WC-1974-POLAND-001", "HOS-FOOT-WC-1982-POLAND-001", "HOS-FOOT-ZBIGNIEW-BONIEK-001", "HOS-FOOT-KAZIMIERZ-DEYNA-001"],
  "sources": ["https://www.laczynaspilka.pl/reprezentacja"],
  "created_at": "2026-08-31T00:00:00+00:00"
}