{
  "id": "HOS-F1-JIM-CLARK-001",
  "title": "Jim Clark",
  "corpus": "MOTORSPORT",
  "category": "FORMUŁA 1/KIEROWCY/MISTRZOWIE ŚWIATA/MEMORIAL",
  "tags": [
    "Jim Clark",
    "Lotus",
    "1963",
    "1965",
    "Memorial"
  ],
  "status": "review",
  "summary": "Dwukrotny mistrz świata Formuły 1, związany z Lotusem. Jedna z najważniejszych postaci historii F1 i światowego motorsportu.",
  "relations": [
    "HOS-F1-MEMORIAL-001"
  ],
  "sources": [
    "https://www.formula1.com/en/drivers/hall-of-fame/Jim_Clark.html"
  ],
  "created_at": "2026-08-30T18:58:37+00:00"
}
