{
  "id": "HOS-FOOT-ZBIGNIEW-BONIEK-001",
  "title": "Zbigniew Boniek",
  "corpus": "PIŁKA NOŻNA",
  "category": "PIŁKARZE/POLSKA/LEGENDY",
  "tags": ["Zbigniew Boniek", "Widzew Łódź", "Polska", "Juventus", "Roma", "1982"],
  "status": "review",
  "summary": "Polski piłkarz, reprezentant kraju i jedna z najważniejszych postaci polskiego futbolu przełomu lat 70. i 80.; istotny węzeł łączący Widzew Łódź, reprezentację Polski, Mundial 1982 oraz włoską piłkę klubową.",
  "relations": ["HOS-FOOT-WIDZEW-LODZ-001", "HOS-FOOT-POLAND-NT-001", "HOS-FOOT-WC-1982-POLAND-001"],
  "sources": ["https://www.uefa.com/", "https://www.laczynaspilka.pl/"],
  "created_at": "2026-08-31T00:00:00+00:00"
}