{
  "id": "HOS-MOTOR-LORENZO-BANDINI-001",
  "title": "Lorenzo Bandini",
  "corpus": "MOTORSPORT",
  "category": "FORMUŁA 1/KIEROWCY/MEMORIAL",
  "tags": ["Lorenzo Bandini", "Ferrari", "Monaco", "1967", "Memorial"],
  "status": "review",
  "summary": "Włoski kierowca Ferrari i jedna z ważnych postaci Scuderii lat 60. Zmarł 10 maja 1967 wskutek obrażeń odniesionych trzy dni wcześniej w wypadku podczas Grand Prix Monako.",
  "relations": [
    "HOS-F1-FERRARI-001",
    "HOS-F1-MEMORIAL-001",
    "HOS-F1-GILLES-VILLENEUVE-001"
  ],
  "sources": [
    "https://www.ferrari.com/en-EN/formula1",
    "https://www.formula1.com/"
  ],
  "created_at": "2026-08-31T00:00:00+00:00"
}
