{
  "id": "HOS-F1-1970-001",
  "title": "Sezon Formuły 1 1970",
  "corpus": "MOTORSPORT",
  "category": "FORMUŁA 1/SEZONY",
  "tags": ["1970", "Jochen Rindt", "Lotus Ford", "mistrzostwa świata"],
  "status": "review",
  "date": "1970",
  "summary": "Sezon 1970 zakończył się mistrzostwem Jochenа Rindta z 45 punktami, przed Jackym Ickxem z 40 punktami. Rindt odniósł pięć zwycięstw: Monaco, Netherlands, France, Great Britain i Germany.",
  "relations": ["HOS-F1-RINDT-001", "HOS-F1-HOCKENHEIM-1970-001"],
  "sources": ["https://www.formula1.com/en/results/1970/drivers", "https://www.formula1.com/en/results/1970/drivers/JOCRIN01/jochen-rindt.html"],
  "created_at": "2026-08-20T06:31:00+02:00",
  "updated_at": null
}
