{
  "id": "HOS-LOTNICTWO-000001",
  "title": "Jan Zumbach",
  "corpus": "LOTNICTWO",
  "category": "POLSKA SZKOŁA LOTNICZA W DĘBLINIE / WYCHOWANKOWIE",
  "tags": ["Jan Zumbach", "Dęblin", "Szkoła Orląt", "Dywizjon 303", "Polskie Siły Powietrzne"],
  "status": "draft",
  "sources": [],
  "relations": [],
  "date": "1915-1986",
  "summary": "Rekord biograficzny Jana Zumbacha, polskiego pilota myśliwskiego i dowódcy Dywizjonu 303. Rekord roboczy do dalszego opracowania i uzupełnienia źródeł.",
  "created_at": "2026-08-20T04:30:00Z",
  "updated_at": null
}
