{
  "id": "HOS-FOOT-KAZIMIERZ-DEYNA-001",
  "title": "Kazimierz Deyna",
  "corpus": "PIŁKA NOŻNA",
  "category": "PIŁKARZE/POLSKA/LEGENDY",
  "tags": ["Kazimierz Deyna", "Polska", "Legia Warszawa", "1974", "legendy"],
  "status": "review",
  "summary": "Jeden z najwybitniejszych polskich piłkarzy XX wieku, reprezentant Polski i kluczowa postać drużyny z lat 70. Węzeł łączący reprezentację, Mundial 1974, Legię Warszawa i historię polskiego futbolu.",
  "relations": ["HOS-FOOT-POLAND-NT-001", "HOS-FOOT-WC-1974-POLAND-001"],
  "sources": ["https://www.laczynaspilka.pl/"],
  "created_at": "2026-08-31T00:00:00+00:00"
}