{
  "id": "HOS-F1-JACK-BRABHAM-001",
  "title": "Jack Brabham",
  "corpus": "MOTORSPORT",
  "category": "FORMUŁA 1/KIEROWCY/MISTRZOWIE ŚWIATA",
  "tags": [
    "Jack Brabham",
    "Brabham",
    "Cooper",
    "1959",
    "1960",
    "1966"
  ],
  "status": "review",
  "summary": "Trzykrotny mistrz świata Formuły 1 i jedyny kierowca, który zdobył tytuł mistrzowski za kierownicą własnego samochodu konstrukcji Brabham.",
  "sources": [
    "https://www.formula1.com/en/drivers/hall-of-fame/Jack_Brabham.html"
  ],
  "created_at": "2026-08-30T18:58:37+00:00"
}
