{
  "id": "HOS-F1-WILLIAMS-001",
  "title": "Williams Racing",
  "corpus": "MOTORSPORT",
  "category": "FORMUŁA 1/ZESPOŁY I KONSTRUKTORZY",
  "tags": [
    "Williams",
    "Frank Williams",
    "F1",
    "Grove",
    "Nigel Mansell"
  ],
  "status": "review",
  "summary": "Brytyjski zespół F1 założony przez Franka Williamsa i Patricka Heada; wielokrotny mistrz konstruktorów i ważny element historii brytyjskiej F1.",
  "sources": [
    "https://www.formula1.com/en/teams/williams"
  ],
  "created_at": "2026-08-30T18:58:37+00:00"
}
