{
  "id": "HOS-LOT-ZUMBACH-001",
  "title": "Jan Zumbach",
  "corpus": "HISTORIA",
  "category": "LOTNICTWO/POLSKA SZKOŁA LOTNICZA W DĘBLINIE/WYCHOWANKOWIE",
  "tags": ["Jan Zumbach", "Szkoła Orląt", "Dęblin", "Dywizjon 303", "Polskie Siły Powietrzne", "II wojna światowa"],
  "status": "draft",
  "sources": ["Do uzupełnienia podczas weryfikacji źródłowej"],
  "relations": [],
  "date": "1915-1986",
  "summary": "Jan Zumbach (1915–1986), polski pilot myśliwski i dowódca związany z Polskimi Siłami Powietrznymi oraz Dywizjonem 303. Rekord przeznaczony do dalszego opracowania biograficznego i powiązania z korpusem polskiej szkoły lotniczej w Dęblinie.",
  "created_at": "2026-08-20T06:20:00+02:00",
  "updated_at": null
}
