{
  "id": "HOS-F1-STEPHANE-SARRAZIN-001",
  "title": "Stéphane Sarrazin",
  "corpus": "MOTORSPORT",
  "category": "FORMUŁA 1/KIEROWCY/ENDURANCE",
  "tags": [
    "Stéphane Sarrazin",
    "Minardi",
    "Toyota",
    "Le Mans",
    "WEC"
  ],
  "status": "review",
  "summary": "Francuski kierowca, który startował w F1 dla Minardi, a później odnosił sukcesy w endurance i Le Mans.",
  "sources": [],
  "created_at": "2026-08-30T18:58:37+00:00"
}
