{
  "id": "HOS-FOOT-IGOR-SYPNIEWSKI-001",
  "title": "Igor Sypniewski",
  "corpus": "PIŁKA NOŻNA",
  "category": "PIŁKARZE/POLSKA/BIOGRAFIE",
  "tags": ["Igor Sypniewski", "ŁKS Łódź", "Panathinaikos", "Wisła Kraków", "reprezentacja Polski"],
  "status": "review",
  "summary": "Polski napastnik i ofensywny pomocnik, zapamiętany jako wyjątkowo utalentowany zawodnik. Węzeł biograficzny przeznaczony do połączenia kariery klubowej w Polsce i Grecji, występów reprezentacyjnych oraz materiałów wspomnieniowych.",
  "relations": ["HOS-FOOT-POLAND-NT-001"],
  "sources": ["https://www.laczynaspilka.pl/"],
  "created_at": "2026-08-31T00:00:00+00:00"
}