{
  "id": "HOS-MOTOR-KEN-MILES-001",
  "title": "Ken Miles",
  "corpus": "MOTORSPORT",
  "category": "ENDURANCE/KIEROWCY/TESTERZY/MEMORIAL",
  "tags": ["Ken Miles", "Ford", "Shelby American", "Le Mans", "Daytona", "Sebring", "1966"],
  "status": "review",
  "summary": "Brytyjski kierowca wyścigowy i tester, kluczowa postać programu Ford GT40. W 1966 wygrał Daytona i Sebring, a w Le Mans zajął drugie miejsce po kontrowersyjnym finiszu Forda. Zginął 18 sierpnia 1966 podczas testów Forda J-Car na Riverside.",
  "relations": [
    "HOS-MOTOR-CARROLL-SHELBY-001",
    "HOS-MOTOR-FORD-GT40-MKII-001",
    "HOS-MOTOR-LE-MANS-1966-001",
    "HOS-F1-BRUCE-MCLAREN-001"
  ],
  "sources": [
    "https://corporate.ford.com/articles/history/ford-gt40-origins-le-mans-committee-victory.html",
    "https://corporate.ford.com/articles/history/ford-gt40-origins-427-gt40x.html"
  ],
  "created_at": "2026-08-31T00:00:00+00:00"
}
