{
  "id": "HOS-MOTOR-CARROLL-SHELBY-001",
  "title": "Carroll Shelby",
  "corpus": "MOTORSPORT",
  "category": "ENDURANCE/KIEROWCY/KONSTRUKTORZY/ZARZĄDZANIE",
  "tags": ["Carroll Shelby", "Shelby American", "Ford", "GT40", "Le Mans"],
  "status": "review",
  "summary": "Amerykański kierowca, konstruktor i szef zespołu. Po zakończeniu kariery kierowcy odegrał kluczową rolę w rozwoju programu Ford GT40 i w zwycięskiej kampanii Forda w Le Mans.",
  "relations": [
    "HOS-MOTOR-KEN-MILES-001",
    "HOS-MOTOR-FORD-GT40-MKII-001",
    "HOS-MOTOR-LE-MANS-1966-001",
    "HOS-F1-BRUCE-MCLAREN-001",
    "HOS-MOTOR-CHRIS-AMON-001"
  ],
  "sources": [
    "https://corporate.ford.com/articles/history/ford-gt40-origins-427-gt40x.html",
    "https://corporate.ford.com/articles/history/ford-gt40-origins-le-mans-committee-victory.html"
  ],
  "created_at": "2026-08-31T00:00:00+00:00"
}
