{
  "id": "HOS-F1-GILLES-VILLENEUVE-001",
  "title": "Gilles Villeneuve",
  "corpus": "MOTORSPORT",
  "category": "FORMUŁA 1/KIEROWCY/MEMORIAL",
  "tags": [
    "Gilles Villeneuve",
    "Ferrari",
    "Imola 1982",
    "Zolder 1982",
    "Memorial"
  ],
  "status": "review",
  "summary": "Kanadyjski kierowca Ferrari, jedna z najbardziej pamiętnych postaci Formuły 1. Jego rywalizacja w Imoli 1982 i śmierć podczas kwalifikacji w Zolder należą do kluczowych historii pamięci F1.",
  "relations": [
    "HOS-F1-MEMORIAL-001",
    "HOS-F1-FERRARI-001",
    "HOS-MOTOR-LORENZO-BANDINI-001"
  ],
  "sources": [
    "https://www.formula1.com/en/drivers/hall-of-fame/Gilles_Villeneuve.html",
    "https://www.ferrari.com/en-EN/formula1/1000-gp-belgian-gp-1982"
  ],
  "created_at": "2026-08-30T18:58:37+00:00"
}
